ID,Title,Alternative Title (en),Media Type,Status,Premiered Season,Genres,User Score,Number of Ratings,Number of Members,Studios,Rating
10049,Nurarihyon no Mago: Sennen Makyou,Nura: Rise of the Yokai Clan - Demon Capital,tv,finished_airing,Summer 2011,"Action, Mythology, Shounen, Supernatural",7.93,85061,166611,Studio Deen,pg_13
10162,Usagi Drop,Bunny Drop,tv,finished_airing,Summer 2011,"Childcare, Iyashikei, Josei, Slice of Life",8.33,247900,505346,Production I.G,pg_13
10408,Hotarubi no Mori e,Into the Forest of Fireflies' Light,movie,finished_airing,Summer 2011,"Award Winning, Drama, Romance, Shoujo, Supernatural",8.27,469016,841210,Brain's Base,g
10156,Sacred Seven,Sacred Seven,tv,finished_airing,Summer 2011,"Action, School, Sci-Fi, Super Power",6.58,33902,79939,Sunrise,pg_13
10686,Naruto: Honoo no Chuunin Shiken! Naruto vs. Konohamaru!!,Naruto Shippuden: Chunin Exam on Fire! Naruto vs. Konohamaru!,movie,finished_airing,Summer 2011,"Action, Adventure, Martial Arts, Shounen",7.17,42858,82583,Pierrot,pg_13
10372,Kamisama Dolls,Kamisama Dolls,tv,finished_airing,Summer 2011,"Action, Seinen, Supernatural",6.99,31433,73864,Brain's Base,r
9917,Pokemon Movie 14 White: Victini to Kuroki Eiyuu Zekrom,Pokémon the Movie: White - Victini and Zekrom,movie,finished_airing,Summer 2011,"Adventure, Comedy, Drama, Fantasy, Kids",6.64,35434,60828,"Production I.G, Xebec, OLM",pg
10740,Pokemon Movie 14 Black: Victini to Shiroki Eiyuu Reshiram,Pokémon the Movie: Black - Victini and Reshiram,movie,finished_airing,Summer 2011,"Adventure, Comedy, Drama, Fantasy, Kids",6.63,29679,51568,"Production I.G, Xebec, OLM",pg
9938,Ikoku Meiro no Croisée The Animation,Croisée in a Foreign Labyrinth The Animation,tv,finished_airing,Summer 2011,"Historical, Iyashikei, Seinen, Slice of Life",7.41,24551,60007,Satelight,g
10278,The iDOLM@STER,THE IDOLM@STER,tv,finished_airing,Summer 2011,"Comedy, Drama, Idols (Female), Music",7.61,54873,155649,A-1 Pictures,pg_13
11061,Hunter x Hunter (2011),Hunter x Hunter,tv,finished_airing,Fall 2011,"Action, Adventure, Fantasy, Shounen",9.03,1824007,2937494,Madhouse,pg_13
9000,Toaru Hikuushi e no Tsuioku,The Princess and the Pilot,movie,finished_airing,Fall 2011,"Adult Cast, Adventure, Military, Romance",7.59,31242,77310,Madhouse,pg_13
10460,Kimi to Boku.,You and Me.,tv,finished_airing,Fall 2011,"Iyashikei, School, Shounen, Slice of Life",7.65,63195,189364,J.C.Staff,pg_13
10717,Towa no Quon 6: Towa no Quon,Towanoquon: Eternal Quon,movie,finished_airing,Fall 2011,"Action, Sci-Fi, Super Power",7.56,18993,43076,Bones,pg_13
10030,Bakuman. 2nd Season,Bakuman. Season 2,tv,finished_airing,Fall 2011,"Comedy, Drama, Otaku Culture, Romance, Shounen",8.34,215817,359535,J.C.Staff,pg_13
10800,Chihayafuru,Chihayafuru,tv,finished_airing,Fall 2011,"Drama, Josei, Love Polygon, School, Sports, Strategy Game",8.18,187346,472618,Madhouse,pg_13
9617,K-On! Movie,K-ON! The Movie,movie,finished_airing,Fall 2011,"Award Winning, CGDCT, Comedy, Music",8.35,199990,338924,Kyoto Animation,pg_13
10087,Fate/Zero,Fate/Zero,tv,finished_airing,Fall 2011,"Action, Fantasy, Urban Fantasy",8.27,876858,1533137,ufotable,r
10521,Working'!!,Wagnaria!!2,tv,finished_airing,Fall 2011,"Comedy, Love Status Quo, Seinen, Workplace",7.81,154006,268860,A-1 Pictures,pg_13
10378,Shinryaku!? Ika Musume,The Squid Girl 2,tv,finished_airing,Fall 2011,"Anthropomorphic, Comedy, Shounen",7.47,50037,101853,Diomedéa,pg_13
9981,Phi Brain: Kami no Puzzle,Phi-Brain ~ Puzzle of God,tv,finished_airing,Fall 2011,"Action, High Stakes Game, Mystery, Strategy Game, Suspense",7.16,45331,110612,Sunrise,pg_13
10620,Mirai Nikki (TV),The Future Diary,tv,finished_airing,Fall 2011,"Action, Gore, High Stakes Game, Psychological, Shounen, Supernatural, Survival, Suspense",7.39,1232411,2052760,asread.,r+
10396,Ben-To,Ben-To,tv,finished_airing,Fall 2011,"Action, Comedy, Gourmet, Martial Arts",7.19,169900,334286,David Production,pg_13
10232,Tamayura: Hitotose,None,tv,finished_airing,Fall 2011,"CGDCT, Iyashikei, Slice of Life",7.32,14362,49364,TYO Animations,g
11457,Chibi☆Devi!,None,tv,finished_airing,Fall 2011,"Childcare, Mythology, Shoujo, Slice of Life, Supernatural",6.9,7615,21985,SynergySP,pg
10808,Kidou Senshi Gundam AGE,Mobile Suit Gundam AGE,tv,finished_airing,Fall 2011,"Action, Mecha, Sci-Fi, Space",6.47,15781,33816,Sunrise,pg_13
11385,Digimon Xros Wars: Toki wo Kakeru Shounen Hunter-tachi,Digimon Fusion,tv,finished_airing,Fall 2011,"Action, Adventure, Comedy, Fantasy, Isekai",6.41,13824,27818,Toei Animation,pg
10793,Guilty Crown,Guilty Crown,tv,finished_airing,Fall 2011,"Action, Drama, Mecha, Sci-Fi, Super Power",7.4,646120,1236715,Production I.G,r
10588,Persona 4 the Animation,Persona 4 the Animation,tv,finished_airing,Fall 2011,"Action, Mystery, School, Sci-Fi, Super Power, Supernatural",7.51,132337,269384,AIC ASTA,pg_13
6773,Shakugan no Shana III (Final),Shakugan no Shana: Season III,tv,finished_airing,Fall 2011,"Action, Drama, Fantasy, Romance, School, Urban Fantasy",7.5,119299,241059,J.C.Staff,pg_13
10336,Last Exile: Ginyoku no Fam,"Last Exile: Fam, the Silver Wing",tv,finished_airing,Fall 2011,"Action, Adventure, Sci-Fi",7.06,17685,47200,Gonzo,pg_13
11665,Natsume Yuujinchou Shi,Natsume's Book of Friends Season 4,tv,finished_airing,Winter 2012,"Iyashikei, Mythology, Shoujo, Slice of Life, Supernatural",8.64,111735,251767,Brain's Base,pg_13
12021,Poyopoyo Kansatsu Nikki,Poyopoyo,tv,finished_airing,Winter 2012,"Comedy, Pets, Seinen, Slice of Life",7.63,9760,21668,Studio Deen,pg
11341,Tantei Opera Milky Holmes Dai 2 Maku,Detective Opera Milky Holmes 2,tv,finished_airing,Winter 2012,"Comedy, Detective, Mystery, Parody, Super Power",7.19,8376,19296,"J.C.Staff, Artland",pg_13
11375,.hack//The Movie: Sekai no Mukou ni,None,movie,finished_airing,Winter 2012,"Action, Adventure, Fantasy, Mystery, Sci-Fi, Video Game",7.04,7902,18997,"CyberConnect2, Anima",pg_13
11843,Danshi Koukousei no Nichijou,Daily Lives of High School Boys,tv,finished_airing,Winter 2012,"Comedy, Gag Humor, School",8.23,423966,844587,Sunrise,pg_13
11235,Amagami SS+ Plus,Amagami SS+ plus,tv,finished_airing,Winter 2012,"Harem, Romance, School",7.38,92113,173434,AIC,pg_13
11179,Papa no Iukoto wo Kikinasai!,"Listen to Me, Girls. I Am Your Father!",tv,finished_airing,Winter 2012,"Childcare, Comedy, Romance",7.25,102746,198626,feel.,pg_13
11597,Nisemonogatari,Nisemonogatari,tv,finished_airing,Winter 2012,"Comedy, Ecchi, Mystery, Supernatural",8.13,439222,746106,Shaft,r
11013,Inu x Boku SS,Inu X Boku Secret Service,tv,finished_airing,Winter 2012,"Comedy, Mythology, Romance, Shounen, Supernatural",7.37,238949,512755,David Production,pg_13
11433,Ano Natsu de Matteru,Waiting in the Summer,tv,finished_airing,Winter 2012,"Drama, Love Polygon, Romance, Sci-Fi",7.4,183186,394352,J.C.Staff,pg_13
11319,Zero no Tsukaima F,The Familiar of Zero F,tv,finished_airing,Winter 2012,"Action, Adventure, Comedy, Ecchi, Fantasy, Harem, Isekai, Romance, School",7.42,246543,429757,J.C.Staff,pg_13
10447,Aquarion Evol,Aquarion Evol,tv,finished_airing,Winter 2012,"Action, Fantasy, Mecha, Romance, Sci-Fi",7.07,45747,108050,"Satelight, 8bit",pg_13
10218,Berserk: Ougon Jidai-hen I - Haou no Tamago,Berserk: The Golden Age Arc I - The Egg of the King,movie,finished_airing,Winter 2012,"Action, Adventure, Drama, Fantasy, Gore, Horror, Military, Seinen",7.71,151344,235410,Studio 4°C,r+
11751,Senki Zesshou Symphogear,Symphogear,tv,finished_airing,Winter 2012,"Action, Idols (Female), Music, Sci-Fi",7.04,46133,122363,"Satelight, Encourage Films",pg_13
11617,High School DxD,High School DxD,tv,finished_airing,Winter 2012,"Action, Comedy, Ecchi, Harem, Mythology, Romance, School, Supernatural",7.32,919791,1464574,TNK,r+
11371,Shin Tennis no Oujisama,The Prince of Tennis II,tv,finished_airing,Winter 2012,"School, Shounen, Sports",7.53,32100,65671,"Production I.G, M.S.C",pg_13
9751,Strike Witches Movie,Strike Witches: The Movie,movie,finished_airing,Winter 2012,"Action, Ecchi, Military, Sci-Fi",7.57,19875,43429,AIC,pg_13
8917,Mouretsu Pirates,Bodacious Space Pirates,tv,finished_airing,Winter 2012,"Award Winning, Sci-Fi, Space",7.13,28124,75931,Satelight,pg_13
11697,Area no Kishi,The Knight in the Area,tv,finished_airing,Winter 2012,"Comedy, School, Shounen, Sports, Team Sports",7.16,36032,77649,Shin-Ei Animation,pg_13
12431,Uchuu Kyoudai,Space Brothers,tv,finished_airing,Spring 2012,"Adult Cast, Comedy, Seinen, Space, Workplace",8.48,53826,199264,A-1 Pictures,pg_13
12883,Tsuritama,Tsuritama,tv,finished_airing,Spring 2012,"Comedy, Sci-Fi",7.65,60652,171343,A-1 Pictures,pg_13
12815,Shirokuma Cafe,Polar Bear Cafe,tv,finished_airing,Spring 2012,"Anthropomorphic, Iyashikei, Josei, Slice of Life, Workplace",7.89,24117,97102,Pierrot,g
11001,Toshokan Sensou: Kakumei no Tsubasa,Library Wars: The Wings of Revolution,movie,finished_airing,Spring 2012,"Action, Adult Cast, Comedy, Military, Romance",7.73,9005,24891,Production I.G,pg_13
12117,Meitantei Conan Movie 16: 11-ninme no Striker,Detective Conan Movie 16: The Eleventh Striker,movie,finished_airing,Spring 2012,"Adventure, Comedy, Detective, Mystery, Shounen, Sports, Team Sports",7.7,26386,45558,TMS Entertainment,g
11739,Kimi to Boku. 2,You and Me 2,tv,finished_airing,Spring 2012,"Iyashikei, School, Shounen, Slice of Life",7.92,42728,90350,J.C.Staff,pg_13
11741,Fate/Zero 2nd Season,Fate/Zero Season 2,tv,finished_airing,Spring 2012,"Action, Fantasy, Urban Fantasy",8.54,725048,1140996,ufotable,r
12445,Tasogare Otome x Amnesia,Dusk Maiden of Amnesia,tv,finished_airing,Spring 2012,"Horror, Mystery, Romance, School, Shounen, Supernatural",7.81,185953,413622,SILVER LINK.,r
12113,Berserk: Ougon Jidai-hen II - Doldrey Kouryaku,Berserk: The Golden Age Arc II - The Battle for Doldrey,movie,finished_airing,Spring 2012,"Action, Adventure, Drama, Fantasy, Gore, Horror, Military, Seinen",7.87,141809,220564,Studio 4°C,r+
11771,Kuroko no Basket,Kuroko's Basketball,tv,finished_airing,Spring 2012,"School, Shounen, Sports, Team Sports",8.05,730040,1237813,Production I.G,pg_13
12189,Hyouka,Hyouka,tv,finished_airing,Spring 2012,"Mystery, School, Slice of Life",8.06,658671,1409345,Kyoto Animation,pg_13
12413,Jormungand,Jormungand,tv,finished_airing,Spring 2012,"Action, Adult Cast, Adventure, Military, Organized Crime, Seinen",7.79,156568,375570,White Fox,r+
12531,Sakamichi no Apollon,Kids on the Slope,tv,finished_airing,Spring 2012,"Drama, Historical, Josei, Love Polygon, Music, Romance, School",8.29,175927,396285,"Tezuka Productions, MAPPA",pg_13
12149,AKB0048,AKB0048,tv,finished_airing,Spring 2012,"Idols (Female), Music, Sci-Fi",7.35,29129,63092,Satelight,pg_13
10389,Momo e no Tegami,A Letter to Momo,movie,finished_airing,Spring 2012,"Award Winning, Drama, Supernatural",7.57,35856,85678,Production I.G,g
12753,Phi Brain: Kami no Puzzle - Orpheus Order-hen,Phi-Brain ~ Puzzle of God: The Orpheus Order,tv,finished_airing,Spring 2012,"Action, High Stakes Game, Mystery, Strategy Game, Suspense",7.26,22092,49448,Sunrise,pg_13
10790,Kore wa Zombie desu ka? of the Dead,Is This a Zombie? of the Dead,tv,finished_airing,Spring 2012,"Action, Comedy, Ecchi, Fantasy, Harem, Urban Fantasy, Vampire",7.47,220275,385187,Studio Deen,r
10884,Saki Achiga-hen: Episode of Side-A,Saki Episode of Side A,tv,finished_airing,Spring 2012,"School, Slice of Life, Strategy Game",7.31,16636,38381,Studio Gokumi,pg_13
13231,Metal Fight Beyblade Zero G,Beyblade: Shogun Steel,tv,finished_airing,Spring 2012,"Adventure, Kids, Sports",6.04,8752,16178,SynergySP,pg
12979,Naruto SD: Rock Lee no Seishun Full-Power Ninden,Naruto Spin-Off: Rock Lee & His Ninja Pals,tv,finished_airing,Spring 2012,"Action, Comedy, Parody, Shounen",7.17,50705,101436,Pierrot,pg_13
12471,Eureka Seven AO,None,tv,finished_airing,Spring 2012,"Action, Adventure, Drama, Mecha, Sci-Fi",6.64,43175,98237,Bones,pg_13
13261,Inazuma Eleven Go: Chrono Stone,None,tv,finished_airing,Spring 2012,"Sports, Super Power, Team Sports, Time Travel",7.28,37218,62083,OLM,g
21899,Gintama: Yorinuki Gintama-san on Theater 2D,None,movie,finished_airing,Summer 2012,"Action, Comedy, Gag Humor, Historical, Parody, Samurai, Sci-Fi, Shounen",8.42,17361,45488,Sunrise,pg_13
10153,Mahou Shoujo Lyrical Nanoha: The Movie 2nd A's,Magical Girl Lyrical Nanoha: The Movie 2nd A's,movie,finished_airing,Summer 2012,"Action, Comedy, Drama, Mahou Shoujo, Sci-Fi",8.11,11230,24820,Seven Arcs,r+
12403,Yuru Yuri♪♪,YuruYuri: Happy Go Lily ♪♪,tv,finished_airing,Summer 2012,"CGDCT, Comedy, Gag Humor, Girls Love, School",7.81,104098,190286,Doga Kobo,pg_13
11757,Sword Art Online,Sword Art Online,tv,finished_airing,Summer 2012,"Action, Adventure, Fantasy, Love Polygon, Romance, Video Game",7.21,2188466,3145998,A-1 Pictures,pg_13
12355,Ookami Kodomo no Ame to Yuki,Wolf Children,movie,finished_airing,Summer 2012,"Award Winning, Childcare, Slice of Life, Supernatural",8.56,468097,830479,Studio Chizu,pg_13
12031,Kingdom,Kingdom,tv,finished_airing,Summer 2012,"Action, Historical, Military, Seinen",7.89,79840,231271,Pierrot,r
11783,Dog Days',None,tv,finished_airing,Summer 2012,"Action, Adventure, Fantasy, Isekai",6.98,55355,106832,Seven Arcs,pg_13
15059,Initial D Fifth Stage,None,tv,finished_airing,Fall 2012,"Action, Drama, Racing, Seinen",8.11,82511,157447,SynergySP,pg_13
13331,Jormungand: Perfect Order,Jormungand Season 2: Perfect Order,tv,finished_airing,Fall 2012,"Action, Adult Cast, Adventure, Military, Organized Crime, Seinen",7.89,107166,198395,White Fox,r+
11977,Mahou Shoujo Madoka★Magica Movie 1: Hajimari no Monogatari,Puella Magi Madoka Magica the Movie Part 1: Beginnings,movie,finished_airing,Fall 2012,"Drama, Mahou Shoujo, Psychological, Suspense",8.22,103674,205262,Shaft,pg_13
15417,Gintama': Enchousen,Gintama: Enchousen,tv,finished_airing,Fall 2012,"Action, Comedy, Gag Humor, Historical, Parody, Samurai, Sci-Fi, Shounen",9.02,169519,334402,Sunrise,pg_13
11979,Mahou Shoujo Madoka★Magica Movie 2: Eien no Monogatari,Puella Magi Madoka Magica the Movie Part 2: Eternal,movie,finished_airing,Fall 2012,"Drama, Mahou Shoujo, Psychological, Suspense",8.37,103379,208495,Shaft,pg_13
11239,Hidamari Sketch x Honeycomb,None,tv,finished_airing,Fall 2012,"CGDCT, Iyashikei, School, Slice of Life, Visual Arts",7.93,11012,24863,Shaft,pg_13
11737,Ao no Exorcist Movie,Blue Exorcist: The Movie,movie,finished_airing,Fall 2012,"Action, Mythology, School, Shounen, Supernatural",7.57,145565,278529,A-1 Pictures,pg_13
14741,Chuunibyou demo Koi ga Shitai!,"Love, Chunibyo & Other Delusions!",tv,finished_airing,Fall 2012,"Comedy, Romance, School",7.7,795517,1390800,Kyoto Animation,pg_13
14075,Zetsuen no Tempest,Blast of Tempest,tv,finished_airing,Fall 2012,"Action, Drama, Fantasy, Mystery, Psychological, Shounen, Suspense, Urban Fantasy",7.89,264884,608888,Bones,pg_13
13601,Psycho-Pass,Psycho-Pass,tv,finished_airing,Fall 2012,"Action, Adult Cast, Detective, Mystery, Psychological, Sci-Fi, Suspense",8.33,799928,1670727,Production I.G,r
14719,JoJo no Kimyou na Bouken (TV),JoJo's Bizarre Adventure (2012),tv,finished_airing,Fall 2012,"Action, Adventure, Historical, Shounen, Supernatural, Vampire",7.88,1108517,1719207,David Production,r
13759,Sakura-sou no Pet na Kanojo,The Pet Girl of Sakurasou,tv,finished_airing,Fall 2012,"Drama, Romance, School, Visual Arts",8.06,720291,1272964,J.C.Staff,pg_13
14713,Kamisama Hajimemashita,Kamisama Kiss,tv,finished_airing,Fall 2012,"Comedy, Mythology, Romance, Shoujo, Supernatural",8.11,348515,677854,TMS Entertainment,pg_13
12859,One Piece Film: Z,One Piece Film: Z,movie,finished_airing,Fall 2012,"Action, Adventure, Fantasy, Shounen",8.11,186135,294203,Toei Animation,pg_13
13125,Shinsekai yori,From the New World,tv,finished_airing,Fall 2012,"Drama, Fantasy, Horror, Mystery, Psychological, Sci-Fi, Suspense",8.25,281694,793251,A-1 Pictures,r
14513,Magi: The Labyrinth of Magic,Magi: The Labyrinth of Magic,tv,finished_airing,Fall 2012,"Action, Adventure, Fantasy, Shounen",8.01,562309,1069663,A-1 Pictures,pg_13
12365,Bakuman. 3rd Season,Bakuman. Season 3,tv,finished_airing,Fall 2012,"Comedy, Drama, Otaku Culture, Romance, Shounen",8.52,197435,335714,J.C.Staff,pg_13
14131,Girls & Panzer,Girls und Panzer,tv,finished_airing,Fall 2012,"Action, CGDCT, Military, School",7.52,153308,312064,Actas,pg_13
3785,Evangelion Movie 3: Q,Evangelion: 3.0 You Can (Not) Redo,movie,finished_airing,Fall 2012,"Action, Award Winning, Drama, Mecha, Psychological, Sci-Fi, Suspense",7.65,275889,459878,Khara,pg_13
15061,Aikatsu!,None,tv,finished_airing,Fall 2012,"Idols (Female), Music, School, Slice of Life",7.47,15044,45242,"Sunrise, Bandai Namco Pictures",pg
12115,Berserk: Ougon Jidai-hen III - Kourin,Berserk: The Golden Age Arc III - The Advent,movie,finished_airing,Winter 2013,"Action, Adventure, Drama, Fantasy, Gore, Horror, Military, Seinen",8.21,145991,232965,Studio 4°C,r+
14397,Chihayafuru 2,None,tv,finished_airing,Winter 2013,"Drama, Josei, Love Polygon, School, Sports, Strategy Game",8.38,132934,241093,Madhouse,pg_13
14349,Little Witch Academia,None,movie,finished_airing,Winter 2013,"Adventure, Comedy, Fantasy, School",7.79,177234,316667,Trigger,pg_13
14353,Death Billiards,Death Billiards,movie,finished_airing,Winter 2013,"Adult Cast, Drama, Fantasy, High Stakes Game, Psychological, Suspense",7.87,139489,243950,Madhouse,r
14511,Minami-ke Tadaima,None,tv,finished_airing,Winter 2013,"CGDCT, Comedy, School, Seinen",7.64,25908,58888,feel.,pg_13
14941,AKB0048: Next Stage,AKB0048: Next Stage,tv,finished_airing,Winter 2013,"Idols (Female), Music, Sci-Fi",7.62,20505,37688,Satelight,pg_13
14175,Hanasaku Iroha Movie: Home Sweet Home,Hanasaku Iroha the Movie: Home Sweet Home,movie,finished_airing,Winter 2013,"Drama, Workplace",7.83,36374,93660,P.A. Works,pg_13
15611,Cardfight!! Vanguard: Link Joker-hen,Cardfight!! Vanguard Link Joker,tv,finished_airing,Winter 2013,"Action, Strategy Game",7.15,12815,24204,TMS Entertainment,pg_13
16498,Shingeki no Kyojin,Attack on Titan,tv,finished_airing,Spring 2013,"Action, Award Winning, Drama, Gore, Military, Shounen, Survival, Suspense",8.55,2870898,4065518,Wit Studio,r
15863,Ginga Kikoutai Majestic Prince,Majestic Prince,tv,finished_airing,Spring 2013,"Action, Mecha, School, Sci-Fi, Seinen, Space",7.33,24322,56779,"Doga Kobo, Orange",pg_13
17249,Pretty Rhythm: Rainbow Live,None,tv,finished_airing,Spring 2013,"Idols (Female), Music, Sports",7.56,5669,14135,"Tatsunoko Production, Dongwoo A&E",pg
15771,Saint☆Oniisan (Movie),Saint☆Young Men (Movie),movie,finished_airing,Spring 2013,"Comedy, Seinen",7.79,44523,98369,A-1 Pictures,pg_13
17187,Koukaku Kidoutai Arise: Ghost in the Shell - Border:1 Ghost Pain,Ghost in the Shell: Arise - Border 1: Ghost Pain,movie,finished_airing,Spring 2013,"Action, Adult Cast, Detective, Mecha, Psychological, Sci-Fi",7.42,30538,65316,Production I.G,r
16241,"Yondemasu yo, Azazel-san. Z","You're Being Summoned, Azazel Z",tv,finished_airing,Spring 2013,"Comedy, Gag Humor, Mythology, Seinen, Supernatural",7.54,21502,41536,Production I.G,r
11577,Steins;Gate Movie: Fuka Ryouiki no Déjà vu,Steins;Gate: The Movie - Load Region of Déjà Vu,movie,finished_airing,Spring 2013,"Drama, Sci-Fi",8.45,363859,609071,White Fox,pg_13
15911,Yuyushiki,Yuyushiki,tv,finished_airing,Spring 2013,"CGDCT, Comedy, Gag Humor, School",7.35,41187,111228,Kinema Citrus,pg_13
14735,Meitantei Conan Movie 17: Zekkai no Private Eye,Detective Conan Movie 17: Private Eye in the Distant Sea,movie,finished_airing,Spring 2013,"Adventure, Comedy, Detective, Mystery, Shounen",7.67,22733,40664,TMS Entertainment,g
12711,Uta no☆Prince-sama♪ Maji Love 2000%,Uta no Prince Sama 2,tv,finished_airing,Spring 2013,"Comedy, Idols (Male), Josei, Music, Reverse Harem, Romance, School",7.17,56908,114567,A-1 Pictures,pg_13
16524,Suisei no Gargantia,Gargantia on the Verdurous Planet,tv,finished_airing,Spring 2013,"Action, Adventure, Mecha, Sci-Fi",7.44,178210,345544,Production I.G,pg_13
16201,Aku no Hana,Flowers of Evil,tv,finished_airing,Spring 2013,"Drama, Psychological, Romance, School, Shounen, Suspense",7.14,81953,232775,Zexcs,r
16049,Toaru Kagaku no Railgun S,A Certain Scientific Railgun S,tv,finished_airing,Spring 2013,"Action, Fantasy, Sci-Fi, Super Power",8.01,209585,397513,J.C.Staff,r
14813,Yahari Ore no Seishun Love Comedy wa Machigatteiru.,My Teen Romantic Comedy SNAFU,tv,finished_airing,Spring 2013,"Comedy, Love Polygon, Romance, School",8.0,872733,1477325,Brain's Base,pg_13
15809,Hataraku Maou-sama!,The Devil is a Part-Timer!,tv,finished_airing,Spring 2013,"Comedy, Supernatural",7.72,973170,1598233,White Fox,pg_13
15583,Date A Live,Date A Live,tv,finished_airing,Spring 2013,"Action, Fantasy, Harem, Romance, School, Sci-Fi",7.15,598942,1065473,AIC PLUS+,r
16782,Kotonoha no Niwa,The Garden of Words,movie,finished_airing,Spring 2013,"Award Winning, Drama, Romance, Visual Arts",7.87,531765,886690,CoMix Wave Films,pg_13
15225,Hentai Ouji to Warawanai Neko.,"The ""Hentai"" Prince and the Stony Cat.",tv,finished_airing,Spring 2013,"Comedy, Harem, Romance, School, Supernatural",7.14,240249,458233,J.C.Staff,pg_13
16035,Karneval (TV),Karneval,tv,finished_airing,Spring 2013,"Action, Fantasy, Josei, Mystery, Sci-Fi",7.07,91124,219293,Manglobe,pg_13
15699,Haiyore! Nyaruko-san W,Nyaruko: Crawling With Love! Second Season,tv,finished_airing,Spring 2013,"Comedy, Parody, Sci-Fi",7.21,94325,185705,Xebec,pg_13
16528,Hal,Hal,movie,finished_airing,Spring 2013,"Drama, Romance, Sci-Fi",7.38,71894,147153,Wit Studio,pg_13
14669,Aura: Maryuuin Kouga Saigo no Tatakai,Aura: Koga Maryuin's Last War,movie,finished_airing,Spring 2013,"Drama, Romance, School",7.28,43964,121169,AIC ASTA,r+
16668,Kakumeiki Valvrave,Valvrave the Liberator,tv,finished_airing,Spring 2013,"Action, Mecha, Military, Sci-Fi, Space",7.12,78959,172712,Sunrise,r
14807,Kara no Kyoukai Movie: Mirai Fukuin,The Garden of Sinners: Future Gospel,movie,finished_airing,Summer 2013,"Drama, Mystery, Supernatural",7.99,55047,119447,ufotable,r
17909,Uchouten Kazoku,The Eccentric Family,tv,finished_airing,Summer 2013,"Anthropomorphic, Award Winning, Comedy, Drama, Fantasy, Mythology, Urban Fantasy",7.82,55004,170941,P.A. Works,pg_13
15197,Code Geass: Boukoku no Akito 2 - Hikisakareshi Yokuryuu,Code Geass: Akito the Exiled - The Wyvern Divided,movie,finished_airing,Summer 2013,"Action, Mecha, Military",7.44,72938,140347,Sunrise,r
13117,Hakuouki Movie 1: Kyoto Ranbu,Hakuoki ~Demon of the Fleeting Blossom~ Wild Dance of Kyoto,movie,finished_airing,Summer 2013,"Action, Drama, Historical, Josei, Samurai, Supernatural",7.59,9833,30205,Studio Deen,pg_13
15731,Tamayura: More Aggressive,None,tv,finished_airing,Summer 2013,"CGDCT, Iyashikei, Slice of Life",7.56,8232,21809,TYO Animations,g
18055,Hakkenden: Touhou Hakken Ibun 2nd Season,Hakkenden -Eight Dogs of the East- Season 2,tv,finished_airing,Summer 2013,"Action, Fantasy, Mystery, Mythology, Shoujo",7.61,29893,64986,Studio Deen,pg_13
15793,Senki Zesshou Symphogear G,Symphogear G,tv,finished_airing,Summer 2013,"Action, Idols (Female), Music, Sci-Fi",7.46,29892,61829,Satelight,pg_13
18119,Servant x Service,Servant x Service,tv,finished_airing,Summer 2013,"Adult Cast, Comedy, Seinen, Workplace",7.62,97985,227367,A-1 Pictures,pg_13
17389,Kingdom 2nd Season,Kingdom: Season 2,tv,finished_airing,Summer 2013,"Action, Historical, Military, Seinen",8.3,65476,133168,Pierrot,r
15451,High School DxD New,High School DxD New,tv,finished_airing,Summer 2013,"Action, Comedy, Ecchi, Harem, Mythology, Romance, School, Supernatural",7.47,604175,933189,TNK,r+
16918,Gin no Saji,Silver Spoon,tv,finished_airing,Summer 2013,"Comedy, School, Shounen",8.09,134100,300016,A-1 Pictures,pg_13
16662,Kaze Tachinu,The Wind Rises,movie,finished_airing,Summer 2013,"Award Winning, Drama, Historical, Romance",8.12,202661,353671,Studio Ghibli,pg_13
15335,Gintama Movie 2: Kanketsu-hen - Yorozuya yo Eien Nare,Gintama: The Movie: The Final Chapter: Be Forever Yorozuya,movie,finished_airing,Summer 2013,"Action, Comedy, Gag Humor, Historical, Parody, Samurai, Sci-Fi, Shounen, Time Travel",8.9,138134,246598,Sunrise,pg_13
17074,Monogatari Series: Second Season,Monogatari Series: Second Season,tv,finished_airing,Summer 2013,"Comedy, Mystery, Romance, Supernatural, Vampire",8.76,365273,685489,Shaft,r
16706,Kami nomi zo Shiru Sekai: Megami-hen,The World God Only Knows: Goddesses,tv,finished_airing,Summer 2013,"Comedy, Harem, Otaku Culture, Romance, Shounen, Supernatural",7.99,197980,353853,Manglobe,pg_13
15039,Ano Hi Mita Hana no Namae wo Bokutachi wa Mada Shiranai. Movie,Anohana: The Flower We Saw That Day The Movie,movie,finished_airing,Summer 2013,"Drama, Supernatural",7.84,144797,301214,A-1 Pictures,pg_13
19319,Gundam Build Fighters,Gundam Build Fighters,tv,finished_airing,Fall 2013,"Action, Mecha, Sci-Fi",7.74,40036,77446,Sunrise,g
18497,Yozakura Quartet: Hana no Uta,None,tv,finished_airing,Fall 2013,"Action, Comedy, Shounen, Super Power, Supernatural",7.44,38157,128119,Tatsunoko Production,pg_13
14407,Persona 3 the Movie 1: Spring of Birth,Persona 3 the Movie: #1 Spring of Birth,movie,finished_airing,Fall 2013,"Action, Super Power, Supernatural",7.53,65120,123583,AIC ASTA,r
19703,Kyousou Giga (TV),Kyousougiga,tv,finished_airing,Fall 2013,"Action, Fantasy",7.69,54272,196226,Toei Animation,pg_13
18195,Little Busters! Refrain,Little Busters! ~Refrain~,tv,finished_airing,Fall 2013,"Comedy, Drama, Romance, School",8.17,78951,169701,J.C.Staff,pg_13
19291,Pokemon XY,Pokémon the Series: XY,tv,finished_airing,Fall 2013,"Action, Adventure, Comedy, Fantasy, Kids",7.43,111274,179604,OLM,pg
18893,Aoki Hagane no Arpeggio: Ars Nova,Arpeggio of Blue Steel -Ars Nova-,tv,finished_airing,Fall 2013,"Action, Sci-Fi, Seinen",7.34,70515,152938,SANZIGEN,pg_13
15813,Majokko Shimai no Yoyo to Nene,Magical Sisters Yoyo & Nene,movie,finished_airing,Fall 2013,Fantasy,7.35,6864,18820,ufotable,g
